{
  "$schema": "../claudehut-pack.schema.json",
  "pack": "claudehut-kernel",
  "version": "0.20.0-dev.1",
  "kernel": "~0.20",
  "kind": "kernel",
  "description": "K1-K11: task state + event log, gates, verify, probe, plane, index core, advisory hooks.",
  "detect": {
    "always": true
  },
  "owns": [
    "bin/**",
    "scripts/kernel/**",
    "scripts/lib/**",
    "scripts/legacy/**",
    "hooks/hooks.json",
    "scripts/bootstrap.sh",
    "scripts/maintain.sh",
    "scripts/inject-phase.sh",
    "scripts/advise-write.sh",
    "scripts/record-*.sh",
    "scripts/verify-subagent.sh",
    "scripts/load-probe.sh",
    "scripts/learning-score.sh",
    "scripts/merge-learnings.sh",
    "scripts/inject-learnings.sh",
    "scripts/harvest-candidates.sh",
    "scripts/hint-explore.sh",
    "scripts/doclint.sh",
    "scripts/doclint-advise.sh",
    "scripts/lint-prompt-length.sh",
    "templates/MEMORY.md.tmpl",
    "templates/reuse-index.json.tmpl",
    "templates/PROJECT.generic.md.tmpl",
    "templates/mcp-recommendations.md",
    "commands/**",
    "templates/LANGUAGE.generic.md.tmpl",
    "templates/architecture.generic.md.tmpl",
    "packs/claudehut-pack.schema.json",
    "scripts/index/claudehut_index.py",
    "scripts/index/extract.py",
    "scripts/index/hub.py",
    "scripts/index/memory.py",
    "scripts/index/planepath.py",
    "scripts/kb/**",
    ".mcp.json"
  ],
  "guides": [],
  "sensors": [],
  "invariants": [],
  "evals": []
}
